question_id,exam_type,subject,topic,subtopic,difficulty,year,passage_id,question_text,image_url,option_a,option_b,option_c,option_d,correct_option,explanation,tags,source,status
BIO-0003,JAMB,Biology,Animal Biology/Physiology,Thermoregulation,easy,2025,,The process that brings about the cooling effect on the body of mammals is,,sweat excretion,digestion,urine formation,respiration,A,,jamb|2025,past-question,active
BIO-0004,JAMB,Biology,Cell Biology,Nucleus Function,medium,2025,,Which of the following controls protein and enzyme syntheses in the cytoplasm of the cell?,,DNA,Nucleus,Chromosome,Mitochondria,B,,jamb|2025,past-question,active
BIO-0005,JAMB,Biology,Animal Biology/Physiology,Feeding Adaptations,medium,2025,,Use the diagram above to answer the question that follows. The structure labelled I is adapted for,,tearing,sieving,boring,sucking,D,,jamb|2025,past-question,active
BIO-0006,JAMB,Biology,Ecology,Feeding Relationships,easy,2025,,A complex feeding relationship between organisms in a habitat that involves transfer of energy in form of food is,,food web,pyramid of numbers,pyramid of energy,food chain,A,,jamb|2025,past-question,active
BIO-0007,JAMB,Biology,Plant Biology,Pollination,easy,2025,,One of the characteristics of insect pollinated flowers is,,large anthers,absence of nectar,scented flowers,scentless flowers,C,,jamb|2025,past-question,active
BIO-0008,JAMB,Biology,Plant Biology,Water Uptake/Osmosis,medium,2025,,The process by which plants absorb water from the soil through their roots is,,diffusion,photosynthesis,osmosis,transpiration,C,,jamb|2025,past-question,active
BIO-0009,JAMB,Biology,Plant Biology,Pollination/Reproduction,medium,2025,,The bright colouration of the flower of a flowering plant is an adaptation for,,reproduction,growth,excretion,respiration,A,,jamb|2025,past-question,active
BIO-0010,JAMB,Biology,Animal Biology/Physiology,Endocrine System,medium,2025,,Use the diagram above to answer the questions that follow. The endocrine gland that is located in the part labelled I is,,parathyroid,thyroid,pituitary,adrenal,C,,jamb|2025,past-question,active
BIO-0011,JAMB,Biology,Animal Biology/Physiology,Nervous System,medium,2025,,One of the components of peripheral nervous system is,,cerebellum,brain,spinal cord,sensory neurones,D,,jamb|2025,past-question,active
BIO-0012,JAMB,Biology,Plant Biology,Germination,medium,2025,,When the cotyledons appear above the soil during germination is called,,epicotyl,epigeal,hypocotyl,hypogeal,B,,jamb|2025,past-question,active
BIO-0013,JAMB,Biology,Animal Biology/Physiology,Teeth/Digestion,medium,2025,,The type of teeth used for tearing in man is labelled,,IV,III,I,II,D,,jamb|2025,past-question,active
BIO-0014,JAMB,Biology,Ecology,Habitat/Animal Behaviour,easy,2025,,Which of these animals create their natural habitats in burrows?,,Bush rat,Dove,Chameleon,Snails,A,,jamb|2025,past-question,active
BIO-0015,JAMB,Biology,Ecology,Camouflage/Adaptation,easy,2025,,The green-brown colour of grasshopper's body in dry grass field is an adaptation for,,camouflage,predation,mating,mimicry,A,,jamb|2025,past-question,active
BIO-0016,JAMB,Biology,Reproduction,Cross-fertilization,medium,2025,,Which of the following is an advantage of cross fertilization?,,Individuals produced are less adapted to local environment,It leads to the production of healthier offspring.,It leads to inbreeding depression.,It leads to the production of weak offsprings.,B,,jamb|2025,past-question,active
BIO-0017,JAMB,Biology,Evolution,Evidence of Evolution,medium,2025,,"In most vertebrates, the common basic plan with a skull, vertebral column and a pair of girdle is an evidence of evolution from",,molecular records,fossil records,comparative anatomy,embryology,C,,jamb|2025,past-question,active
BIO-0018,JAMB,Biology,Ecology,Adaptation/Mating Behaviour,medium,2025,,Example of animal exhibiting mating colouration is,,agama lizard,variegated grasshopper,chameleon,leopard,A,,jamb|2025,past-question,active
BIO-0019,JAMB,Biology,Animal Biology/Physiology,Excretion,medium,2025,,Which of the following is the excretory organ in birds?,,Nephridia,kidneys,Malpighian tubules,Green glands,B,,jamb|2025,past-question,active
BIO-0020,JAMB,Biology,Evolution,Lamarckism,medium,2025,,Whose theory of evolution supports that characters acquired through use or disuse are transmitted to offspring?,,Darwin,Mendel,Morgan,Lamarck,D,,jamb|2025,past-question,active
BIO-0021,JAMB,Biology,Ecology,Soil Types,easy,2025,,The most suitable soil for crops cultivation in Nigeria is,,laterite,loamy,sandy,clayey,B,,jamb|2025,past-question,active
BIO-0022,JAMB,Biology,Plant Biology,Flower Structure/Terminology,medium,2025,,"When calyx of a flower is joined together, it is called",,gamosepalous,polypetalous,gamopetalous,polysepalous,A,,jamb|2025,past-question,active
BIO-0023,JAMB,Biology,Animal Biology/Physiology,Diseases,medium,2025,,Which of the following statements about poliomyelitis is correct?,,It affects both young and old.,It is a bacterial disease.,There is no vaccination against the disease.,It is capable of paralysing the limbs.,D,,jamb|2025,past-question,active
BIO-0024,JAMB,Biology,Genetics,Monohybrid Cross,medium,2025,,What is the phenotype of the offspring produced in F\(_1\)?,,Homozygous tall,Homozygous short,Heterozygous short,Heterozygous tall,D,,jamb|2025,past-question,active
BIO-0025,JAMB,Biology,Plant Biology,Stem Anatomy,medium,2025,,The cortex of a herbaceous stem is made up of,,sclerenchyma and collenchyma,collenchyma and xylem,sclerenchyma and parenchyma,parenchyma and collenchyma,D,,jamb|2025,past-question,active
BIO-0026,JAMB,Biology,Classification/Taxonomy,Plant Classification,medium,2025,,The most advanced spermatophyte that forms the largest group of plant kingdom is the,,fern,angiosperm,cones,gymnosperm,B,,jamb|2025,past-question,active
BIO-0027,JAMB,Biology,Animal Biology/Physiology,Transport Systems,medium,2025,,Which of the following is a medium of transportation in animal cells?,,Latex,Cytoplasm,Cell sap,Blood,D,,jamb|2025,past-question,active
BIO-0028,JAMB,Biology,Cell Biology,Cell Structure/Organelles,medium,2025,,The part labelled I is the,,mitochondrion,cytoplasm,vacuole,nucleus,D,,jamb|2025,past-question,active
BIO-0029,JAMB,Biology,Ecology,Habitats,easy,2025,,Which of these is an estuarine habitat?,,Lagoon,River,Lakes,Ocean,A,,jamb|2025,past-question,active
BIO-0030,JAMB,Biology,Animal Biology/Physiology,Feeding Adaptations,medium,2025,,The mouth parts of a grasshopper are adapted for,,piercing and sucking,sucking and chewing,biting and chewing,biting and sucking,C,,jamb|2025,past-question,active
BIO-0031,JAMB,Biology,Ecology,Population Dynamics,medium,2025,,The following are factors that affect the population growth of an organism except,,predator,food shortage,natality,disease,C,,jamb|2025,past-question,active
BIO-0032,JAMB,Biology,Ecology,Succession,easy,2025,,"In ecological succession, the final stable community is called",,climax,secondary,serial,pioneer,A,,jamb|2025,past-question,active
BIO-0033,JAMB,Biology,Animal Biology/Physiology,Skin/Integumentary System,medium,2025,,The innermost layer of mammalian epidermis is,,capillaries layer,cornified layer,granular layer,Malpighian layer,D,,jamb|2025,past-question,active
BIO-0034,JAMB,Biology,Genetics,Monohybrid Cross Probability,medium,2025,,"In a cross involving a heterozygous red flower plant (Rr) and a white flowered plant (rr), what is the probability that the offspring will be Rr?",,\(\frac{1}{2}\),1,\(\frac{1}{4}\),2,A,,jamb|2025,past-question,active
BIO-0035,JAMB,Biology,Cell Biology,Organelles,medium,2025,,The structure that helps in the formation of cilia and flagella is,,plastid,centriole,golgi bodies,lysosome,B,,jamb|2025,past-question,active
BIO-0036,JAMB,Biology,Animal Biology/Physiology,Skeletal System,medium,2025,,The vertebrate bone responsible for the attachment of the abdominal muscles is,,sacral,thoracic,lumbar,cervical,C,,jamb|2025,past-question,active
BIO-0037,JAMB,Biology,Animal Biology/Physiology,Teeth/Digestion,easy,2025,,The canine teeth are prominent in which group of animals?,,Carnivores,Parasites,Herbivores,Omnivores,A,,jamb|2025,past-question,active
BIO-0038,JAMB,Biology,Plant Biology,Transport in Plants,medium,2025,,Translocation of manufactured food in plants is through the,,pericycle,phloem cells,endodermis,xylem vessels,B,,jamb|2025,past-question,active
BIO-0039,JAMB,Biology,Evolution,Evolutionary Trends,medium,2025,,The most advanced organism in an evolutionary trend among the following is,,planaria,paramecium,earthworm,hydra,C,,jamb|2025,past-question,active
BIO-0040,JAMB,Biology,Ecology,Plant Adaptations,medium,2025,,One of the following adapts baobab tree to savanna habitat.,,Presence of deciduous stem,Presence of tap roots,Presence of broadleaves,Presence of thick bark,D,,jamb|2025,past-question,active
BIO-0041,JAMB,Biology,Genetics,Inherited Disorders,medium,2025,,Albinism is a disorder caused by,,under production of sebum,over secretion of sebum,recessive genes,over production of melanin,C,,jamb|2025,past-question,active
BIO-0042,JAMB,Biology,Animal Biology/Physiology,Nervous System/Reflexes,easy,2025,,An example of a reflex action is,,writing,talking,coughing,walking,C,,jamb|2025,past-question,active
BIO-0043,JAMB,Biology,Evolution,Vestigial Structures,medium,2025,,Which of the following is an example of vestigial structure?,,Elephant trunk,Human appendix,Bird wings,Fish gills,B,,jamb|2025,past-question,active
BIO-0044,JAMB,Biology,Genetics,DNA Structure,medium,2025,,The correct base pair in DNA molecule is,,cytosine - adenine,cytosine - thymine,guanine - adenine,adenine - thymine,D,,jamb|2025,past-question,active
BIO-0045,JAMB,Biology,Ecology,Competition/Natural Selection,medium,2025,,Population replacement among species of organisms in a given habitat under competition is due to,,survival of the fittest,climax community,natural selection,dominant population,C,,jamb|2025,past-question,active
BIO-0046,JAMB,Biology,Evolution,Evidence of Evolution,medium,2025,,Appendix in humans and caecum in herbivores are evidences of evolution from,,vestigial organ,fossil records,comparative anatomy,embryology,A,,jamb|2025,past-question,active
BIO-0047,JAMB,Biology,Ecology,Camouflage/Adaptation,medium,2025,,A form of adaptive colouration that helps animals to remain unnoticed is,,hibernation,aestivation,migration,countershading,D,,jamb|2025,past-question,active
BIO-0048,JAMB,Biology,Genetics,Biotechnology/GMO,medium,2025,,Genetically Modified Organisms (GMO) food products are of benefit to farmers because they are,,resistant crop varieties,susceptible to diseases,of low quality,low yielding varieties,A,,jamb|2025,past-question,active
BIO-0049,JAMB,Biology,Genetics,Variation,easy,2025,,The variation that can be applied in crime detection is,,tongue rolling,height,colour,fingerprints,D,,jamb|2025,past-question,active
BIO-0050,JAMB,Biology,Ecology,Vegetation Zones (Nigeria),medium,2025,,The date palm is commonly planted in Sahel zone of,,Katsina,Borno,Plateau,Taraba,B,,jamb|2025,past-question,active
BIO-0051,JAMB,Biology,Plant Biology,Flower Structure,medium,2025,,The region of a flower stalk attached to flower parts is,,corolla,pedicel,calyx,receptacle,D,,jamb|2025,past-question,active
BIO-0052,JAMB,Biology,Ecology,Nutrient Cycles,medium,2025,,Which of the following processes takes place in the carbon cycle?,,Combustion,Nitrification,Evaporation,Transpiration,A,,jamb|2025,past-question,active
BIO-0053,JAMB,Biology,Plant Biology,Growth Measurement,easy,2025,,An instrument used in measuring plants growth is,,hygrometer,auxanometer,barometer,thermometer,B,,jamb|2025,past-question,active
BIO-0054,JAMB,Biology,Classification/Taxonomy,Protist/Plant Classification,medium,2025,,Chlamydomonas belongs to the phylum,,tracheophyta,protophyta,pteridophyta,bryophyta,B,,jamb|2025,past-question,active
BIO-0055,JAMB,Biology,Plant Biology,Flower Structure/Pollination,medium,2025,,The part of the flower that is brightly coloured and attract pollinating agents such as insects is labelled,,III,I,IV,II,A,,jamb|2025,past-question,active
BIO-0056,JAMB,Biology,Genetics,Blood Groups,hard,2025,,Which of the following blood groups will clump when mixed with anti-a antibody serum?,,A and AB,B only,B and O,A only,A,,jamb|2025,past-question,active
BIO-0057,JAMB,Biology,Plant Biology,Root Anatomy,medium,2025,,Which of these is the correct arrangement of tissues in herbaceous roots from the circumference to the center?,,"piliferous layer, cortex, pericycle, vascular tissue and pith","piliferous layer, cortex, vascular tissues, pericycle and pith","piliferous layer, pericycle, vascular tissues, cortex and pith","piliferous layer, cortex, vascular tissues, pith and pericycle",A,,jamb|2025,past-question,active
BIO-0058,JAMB,Biology,Classification/Taxonomy,Mollusc Anatomy,medium,2025,,The part labelled I is the,,collar,foot,shell,head,C,,jamb|2025,past-question,active
BIO-0059,JAMB,Biology,Cell Biology,Organelles/Nucleus Function,medium,2025,,The function of the organelle labelled II is to,,produce energy for the cell,transport materials outside the cells,transport materials within the cell,coordinate the activities of the cell,D,,jamb|2025,past-question,active
BIO-0060,JAMB,Biology,Cell Biology,Organelles,medium,2025,,The cell component that stores waste products is the,,Golgi apparatus,cell wall,vacuoles,lysosome,C,,jamb|2025,past-question,active
BIO-0061,JAMB,Biology,Ecology,Habitats/Vegetation,medium,2025,,Which of these plants is considered to be common in an estuarine habitat?,,plantain,Gmelina,Iroko,Mangrove,D,,jamb|2025,past-question,active
BIO-0062,JAMB,Biology,Animal Biology/Physiology,Excretory System/Kidney,medium,2025,,Renal artery branches and divides into a mass of blood capillaries in the Bowman's capsule called,,tubule,pelvis,glomerulus,nephron,C,,jamb|2025,past-question,active
