topic,difficulty,question_text,option_a,option_b,option_c,option_d,correct_option,explanation,exam_year
PPC,1,"Which of the following is not emphasized in a production possibility curve?","Scarcity of resources","Unemployment of labour","Inefficiency in the use of resources","Economic development",D,"A PPC illustrates scarcity, choice, and efficiency/inefficiency—not long-run “development.”",JAMB 2024
Organizations,1,"Which of the following NOT among the objectives of OPEC?","to stabilize the price of oil in the world market","to established petroleum refineries in all member state","to stabilize the revenue from oil to producing countries","to make sure that oil flows to all the consuming countries",B,"OPEC coordinates policies; building refineries in every member state isn’t a core objective.",JAMB 2024
Market structures,1,"A market situation with few sellers and many buyers is called","duopoly","Omonopoly","perfect competition","oligopoly",D,"Few sellers = oligopoly (duopoly is a special case of two sellers).",JAMB 2024
Keynesian basics,1,"MPC + MPS equals","Zero","Multiplier","One","APS",C,"By definition, the marginal propensity to consume plus save equals 1.",JAMB 2024
Free market,1,"Producers operating in a free market economy are more efficient as a result of","the existence of competition","government regulation of their activities","the very few number of participants","the commitment of the shareholders",A,"Competition pressures firms to be efficient and innovative.",JAMB 2024
